categorie,nom_exercice,description,gif_url
Exercices epaules,Élévation frontale sur banc incliné,"Cette variante des élévations frontales cible spécifiquement les muscles deltoïdes antérieurs et les muscles du haut du dos (trapèzes). Cet exercice est particulièrement apprécié pour sa capacité à isoler et à renforcer ces groupes musculaires. En plus de renforcer les muscles deltoïdes et du haut du dos, il aide également à améliorer la mobilité de l’épaule, la posture et l’équilibre musculaire entre les deux côtés du corps. La réalisation des élévations frontales sur banc incliné offre de nombreux avantages :",https://www.docteur-fitness.com/wp-content/uploads/2023/08/elevation-frontale-banc-incline.gif
Exercices epaules,Développé épaules assis,"Le développé épaules assis est un exercice de musculation original et exigeant qui cible le haut du corps, en particulier les muscles des épaules (et les triceps dans une moindre mesure), mais aussi la sangle abdominale. C’est là la grande différence avec un développé épaules classique sur un banc de musculation : les abdominaux sont obligés de travailler dur pour stabiliser le corps pendant l’exercice.",https://www.docteur-fitness.com/wp-content/uploads/2023/05/developpe-epaules-assis-dumbbell-z-press.gif
Exercices epaules,Russian twist avec développé épaules,"L’exercice du Russian Twist avec développé épaules (en anglais Russian Twist with Overhead Press) est une combinaison dynamique entre le Russian Twist et le développé épaules, offrant une approche complète de renforcement musculaire. En combinant la torsion du buste avec le mouvement de développé au-dessus de la tête, cet exercice sollicite les muscles abdominaux, les obliques, les épaules, les bras et les muscles du haut du dos. Il présente de nombreux avantages, notamment l’amélioration de la force fonctionnelle, car le mouvement engage plusieurs groupes musculaires en même temps. Votre stabilité du tronc sera également mise à l’épreuve, renforçant ainsi votre équilibre et votre coordination. Par ailleurs, cet exercice sollicite plusieurs groupes musculaires simultanément, ce qui permet de travailler l’endurance musculaire de manière efficace.",https://www.docteur-fitness.com/wp-content/uploads/2023/07/russian-twist-avec-developpe-epaule.gif
Exercices epaules,Développé militaire,"Le développé militaire (military press) est un exercice qui permet de solliciter les muscles des épaules, des pectoraux, du haut du dos, des triceps et de la ceinture abdominale, ce qui en fait un exercice difficile pour les débutants.",https://www.docteur-fitness.com/wp-content/uploads/2000/08/developpe-militaire-exercice-musculation.gif
Exercices epaules,Développé Arnold,"Le développé Arnold (dumbbell Arnold press) est un exercice très efficace pour développer les muscles deltoïdes. Il s’agit d’une variante unique du développé épaules avec haltères, qui doit son nom au bodybuilder, acteur et gouverneur emblématique Arnold Schwarzenegger.",https://www.docteur-fitness.com/wp-content/uploads/2000/08/developpe-arnold-exercice-musculation.gif
Exercices epaules,Face pull,"Le face pull est un exercice d’isolation à la poulie qui permet de faire travailler principalement les épaules et secondairement le dos. Il cible spécifiquement les deltoïdes postérieurs (arrière des épaules), et sollicite aussi les rhomboïdes (les muscles qui vous permettent de serrer vos omoplates) et le milieu des trapèzes.",https://www.docteur-fitness.com/wp-content/uploads/2022/01/face-pull.gif
Exercices epaules,Élévations latérales à la poulie,Les élévations latérales à la poulie sont une variante très appréciée pour l’entraînement des épaules. Il s’agit d’un exercice d’isolation permettant de cibler précisément les muscles deltoïdes. Les élévations latérales peuvent également être effectuées avec des haltères ou une machine à élévation latérale.,https://www.docteur-fitness.com/wp-content/uploads/2022/02/elevations-laterales-poulie.gif
Exercices epaules,Élévations latérales à la machine,Les élévations latérales guidées à la machine permettent d’isoler et de développer efficacement le chef latéral du deltoïde afin de lui donner cette largeur tant recherchée.,https://www.docteur-fitness.com/wp-content/uploads/2022/02/elevation-laterale-machine.gif
Exercices epaules,Développé épaules avec haltères,L’exercice du développé épaules avec haltères est un excellent choix pour l’entraînement des épaules. Il s’agit d’un exercice de base qui nécessite une bonne coordination.,https://www.docteur-fitness.com/wp-content/uploads/2022/02/developpe-epaule-halteres.gif
Exercices epaules,Développé épaules debout à la landmine,Le développé à la landmine (en anglais landmine press) est un exercice de musculation qui consiste à lever une barre calée dans une « mine de terre ».,https://www.docteur-fitness.com/wp-content/uploads/2022/02/developpe-landmine.gif
Exercices epaules,Rotation externe de l’épaule à la poulie,"Le muscle infra-épineux ou sous-épineux de l’épaule est responsable de la rotation externe de l’humérus et il est important pour la stabilisation de l’épaule. Les rotateurs de l’épaule sont essentiels pour les mouvements de poussée comme le développé couché et le développé militaire pour les épaules, donc améliorer la force dans cette zone grâce à des exercices de renforcement augmentera considérablement vos performances de force.",https://www.docteur-fitness.com/wp-content/uploads/2022/04/rotation-externe-epaule-poulie.gif
Exercices epaules,Pec deck inversé,"Le pec deck inversé (machine Reverse Fly ou reverse butterfly en anglais) est une variante sur machine des élévations latérales buste penché (exercice communément appelé « l’oiseau »), un exercice utilisé pour cibler les muscles deltoïdes postérieurs de l’épaule.",https://www.docteur-fitness.com/wp-content/uploads/2021/12/pec-deck-inverse.gif
Exercices epaules,Élévations frontales,"Les élévations frontales avec haltères (dumbbell front raise) sont un exercice de musculation qui cible les muscles des épaules, et plus particulièrement la partie antérieure des muscles.",https://www.docteur-fitness.com/wp-content/uploads/2000/08/elevations-frontales-exercice-musculation.gif
Exercices epaules,Élévations latérales,Les élévations latérales (dumbbell lateral raise) sont un exercice de musculation pour les épaules qui consiste à élever une paire d’haltères sur les côtés du corps.,https://www.docteur-fitness.com/wp-content/uploads/2000/08/elevations-laterales-exercice-musculation.gif
Exercices epaules,Presse à épaules inclinée,Cette machine guidée pour travailler les muscles deltoïdes est excellente que vous ayez envie de prendre de la force ou d’obtenir des épaules musclées.,https://www.docteur-fitness.com/wp-content/uploads/2021/08/presse-epaule-exercice-musculation.gif
Exercices epaules,Élévations latérales avec kettlebell,Les élévations latérales avec kettlebells (kettlebell lateral raise) sont une variante des élévations latérales et c’est un exercice qui permet de renforcer les muscles de l’épaule.,https://www.docteur-fitness.com/wp-content/uploads/2021/12/elevation-laterales-avec-kettlebell.gif
Exercices epaules,Tirage menton avec kettlebell,Le tirage menton avec kettlebell (en anglais kettlebell upright rows) est un exercice composé qui cible les deltoïdes et les trapèzes. Il sollicite aussi dans une moindre mesure les biceps et les muscles grands dorsaux. C’est donc un excellent exercice pour travailler le haut du corps.,https://www.docteur-fitness.com/wp-content/uploads/2021/12/tirage-menton-avec-kettlebell.gif
Exercices epaules,Développé épaule avec kettlebell,Le développé debout avec kettlebell à un bras (single arm kettlebell push press) est un exercice permettant de renforcer les muscles des épaules.,https://www.docteur-fitness.com/wp-content/uploads/2021/12/developpe-epaule-avec-kettlebell.gif
Exercices epaules,Tirage menton barre guidée,Le tirage menton barre guidée est une variante du tirage menton barre libre et c’est un exercice utilisé pour cibler les muscles des épaules.,https://www.docteur-fitness.com/wp-content/uploads/2021/11/tirage-menton-machine-guidee.gif
Exercices epaules,Élévations latérales avec landmine,Le mouvement en arc de cercle des élévations latérales avec landmine (landmine lateral raise) cible vos muscles deltoïdes.,https://www.docteur-fitness.com/wp-content/uploads/2000/08/elevation-laterale-landmine-exercice-musculation.gif
Exercices epaules,Oiseau assis sur un banc,L’oiseau avec haltères en position assise sur un banc (en anglais seated bent over dumbbell reverse fly) est une variante de l’oiseau debout buste penché avec haltères. C’est un exercice utilisé pour muscler les deltoïdes postérieurs. Cette variante est préférable si vous ressentez une tension en bas du dos avec la version debout.,https://www.docteur-fitness.com/wp-content/uploads/2021/12/oiseau-assis-sur-banc.gif
Exercices epaules,Développé épaule unilatéral avec élastique,"Si vous ne deviez choisir qu’un seul exercice pour muscler les épaules, ce serait probablement un mouvement de développé. Mais il n’est pas nécessaire d’avoir des charges libres pour faire des développés. Le développé épaule avec élastique est une excellente variante qui permet de renforcer vos deltoïdes tout en ménageant les articulations.",https://www.docteur-fitness.com/wp-content/uploads/2022/08/developpe-epaule-unilateral-avec-elastique.gif
Exercices epaules,Développé épaules à la Smith machine,"Le développé épaules est un exercice composé du haut du corps très intéressant. Il peut être effectué à l’aide de poids libres comme les haltères, les kettlebells, les bandes de résistance, à la barre ou avec l’aide d’appareils de musculation comme la Smith Machine. Le mouvement implique l’utilisation de vos muscles stabilisateurs des avant-bras, des bras et des épaules afin que vos articulations restent en place pour maintenir la posture pendant que vous soulevez les charges.",https://www.docteur-fitness.com/wp-content/uploads/2022/08/developpe-epaules-smith-machine.gif
Exercices epaules,Tirage menton avec élastique,"Le tirage vertical, aussi appelé tirage menton ou rowing menton (en anglais upright rows), est un exercice très populaire pour travailler les deltoïdes ainsi que les muscles trapèzes. Cet exercice souffre d’une image négative à cause du stress articulaire qu’il engendre, mais les bandes de résistance peuvent vous apporter une solution plus adaptée aux articulations qu’avec une barre ou des haltères.",https://www.docteur-fitness.com/wp-content/uploads/2022/02/tirage-menton-avec-elastique.gif
Exercices epaules,Oiseau avec élastique,"L’oiseau avec élastique, aussi appelé élévation latérale buste penché (en anglais bent over reverse fly) est une variante de l’oiseau avec haltère qui permet de renforcer les muscles des épaules.",https://www.docteur-fitness.com/wp-content/uploads/2022/09/oiseau-avec-elastique.gif
Exercices epaules,Développé épaules avec élastique,Le développé épaules est le meilleur des exercices pour développer la force et la masse musculaire des deltoïdes. Le développé épaules avec élastique est une excellente variante qui vous permettra de développer des épaules larges tout en ménageant vos articulations.,https://www.docteur-fitness.com/wp-content/uploads/2022/08/developpe-epaules-avec-elastique.gif
Exercices epaules,Élévations latérales inclinées avec haltère,"Les élévations latérales inclinées (en anglais leaning dumbbell lateral raise) améliorent l’esthétique générale et la définition de vos épaules. Par rapport aux élévations latérales avec haltère classique, cette variante en position inclinée (en anglais leaning dumbbell lateral raise) met le deltoïde externe sous tension sur une plus grande partie de l’amplitude du mouvement, ce qui rend chaque répétition plus efficace.",https://www.docteur-fitness.com/wp-content/uploads/2022/06/elevation-laterale-incline-haltere.gif
Exercices epaules,Rotation externe de l’épaule couchée avec haltère,"La plupart d’entre nous se sont blessés ou ont entendu quelqu’un qui s’est blessé la coiffe des rotateurs. Celle-ci est constituée d’une combinaison de 4 muscles de l’épaule qui stabilisent non seulement l’épaule, mais assurent également la mobilité de nos omoplates.",https://www.docteur-fitness.com/wp-content/uploads/2022/06/rotation-externe-epaule-haltere.gif
Exercices epaules,Handstand push-up,"La plupart des gens font des variantes du overhead press (développé militaire) et différents exercices d’isolation pour se muscler les épaules. Pourtant, il existe un exercice de musculation oublié de tous, qui mettra à l’épreuve même les plus forts d’entre nous… c’est le handstand push-up (HSPU).",https://www.docteur-fitness.com/wp-content/uploads/2022/04/handstand-push-up.gif
Exercices epaules,Pompes piquées,"Les pompes piquées ou pompes pour les épaules (en anglais pike push-up) sont un excellent exercice pour muscler les deltoïdes antérieurs, les triceps et le haut des pectoraux au poids de corps. Les pompes piquées sont un très bon exercice de transition si vous souhaitez acquérir de la force pour faire le handstand push-up.",https://www.docteur-fitness.com/wp-content/uploads/2022/06/pike-push-up.gif
Exercices epaules,Croix de fer avec haltères,"Il y a de fortes chances que vous n’ayez jamais entendu parler de cet exercice ou que vous ne l’ayez jamais vu être effectué. Et pourtant, la croix de fer avec haltères (en anglais dumbbell iron cross) a tout à fait sa place dans tout programme d’entraînement.",https://www.docteur-fitness.com/wp-content/uploads/2022/04/croix-de-fer-halteres.gif
Exercices epaules,Extension horizontale des épaules avec élastique,"Cet exercice avec élastique (appelé en anglais band pull apart) est excellent pour travailler et renforcer les muscles de l’arrière des épaules. Avec un élastique de faible résistance, les extensions horizontales des épaules sont excellentes pour échauffer cette zone du haut du dos, mais aussi pour réaliser des exercices de rééducation.",https://www.docteur-fitness.com/wp-content/uploads/2022/03/extension-horizontale-de-epaule-elastique.gif
Exercices epaules,Thruster avec kettlebell,Le thruster avec kettlebell est une variante du thruster avec haltères. C’est un exercice combiné qui associe le mouvement du squat avant à celui du développé militaire.,https://www.docteur-fitness.com/wp-content/uploads/2021/12/thruster-kettlebell.gif
Exercices epaules,Développé épaule unilatéral à genou avec landmine,"Le développé épaule avec landmine est une variante exceptionnelle du mouvement de base qu’est le développé vertical. En raison de l’angle de travail particulier selon lequel vous poussez vers le haut et l’avant en même temps, cet exercice peut ajouter une toute nouvelle dimension à votre entraînement pour les épaules. Si vous ne travaillez qu’avec des barres et des haltères, cet exercice peut vous permettre d’obtenir d’excellents résultats.",https://www.docteur-fitness.com/wp-content/uploads/2022/11/developpe-epaules-unilateral-landmine.gif
Exercices epaules,Élévations latérales unilatérales à la poulie,"Si vous voulez des épaules larges, qui donneront l’illusion d’une taille fine, et si vous voulez que vos muscles deltoïdes soient bien ronds, il est essentiel de ne pas se contenter de faire des exercices de développé épaules, mais de faire aussi des exercices d’élévation latérale.",https://www.docteur-fitness.com/wp-content/uploads/2022/11/elevations-laterales-unilaterale-poulie.gif
Exercices epaules,Développé épaules assis avec élastique,"Le développé épaules assis avec élastique est un exercice idéal à faire à la maison ou au bureau pour renforcer et développer des deltoïdes forts et musclés. Bien que cet exercice se concentre sur les muscles des épaules, il s’agit d’un mouvement qui permet aussi de travailler les triceps.",https://www.docteur-fitness.com/wp-content/uploads/2022/11/developpe-epaules-assis-avec-elastique.gif
Exercices epaules,Développé épaules à la machine,"Le développé épaules (en anglais overhead press) peut être réalisé avec des haltères, une barre ou une machine. Les développés avec barre sont privilégiés dans les sports de force, et les haltères sont tout aussi populaires auprès des amateurs de musculation, mais il ne faut pas perdre de vue que les machines peuvent être une alternative aux mouvements composés de base, tant pour diversifier la gamme d’exercices que pour bénéficier des avantages uniques des machines.",https://www.docteur-fitness.com/wp-content/uploads/2022/11/developpe-epaules-a-la-machine-shoulder-press.gif
Exercices epaules,Oiseau inversé avec sangles de suspension,L’oiseau inversé fait partie des exercices les plus élémentaires pour l’entraînement des épaules. Ce mouvement au poids du corps cible l’arrière des épaules et le haut du dos en utilisant des sangles de suspension ou des anneaux de gymnastique.,https://www.docteur-fitness.com/wp-content/uploads/2022/10/oiseau-inverse-avec-sangles-de-suspension.gif
Exercices epaules,Thruster avec landmine,"Le thruster avec landmine est un exercice combiné qui associe un squat avec landmine et un développé épaule à la landmine. Cet exercice complet cible à la fois les muscles des quadriceps et des épaules, mais tous les autres muscles seront également impliqués pour aider au mouvement et à la stabilisation. Il est idéal dans le cadre de séances d’entraînement visant à brûler un grand nombre de calories et améliorer les performances générales.",https://www.docteur-fitness.com/wp-content/uploads/2022/10/thruster-landmine.gif
Exercices epaules,Rotations cubaines,"La rotation cubaine avec haltères n’a pas pour but de développer la masse musculaire. Il s’agit d’un exercice qui permet de préserver la santé de l’épaule en renforçant trois des quatre muscles de la coiffe des rotateurs : petit rond, infra-épineux et supra-épineux (le muscle restant de la coiffe des rotateurs étant le sous-scapulaire). Les muscles de la coiffe des rotateurs et leurs tendons contribuent à stabiliser votre épaule. Leur renforcement permet donc d’obtenir une articulation de l’épaule forte et stable.",https://www.docteur-fitness.com/wp-content/uploads/2022/06/rotation-externe-vertical-epaule-haltere.gif
Exercices epaules,Élévations frontales à la poulie basse,"Les élévations frontales à la poulie (double cable front raise) sont un exercice d’isolation qui permet de muscler et de renforcer les deltoïdes antérieurs. L’utilisation des poulies constitue une excellente alternative aux haltères, car le muscle est soumis à une tension constante, ce qui contribue à la prise de masse et de force musculaire.",https://www.docteur-fitness.com/wp-content/uploads/2022/04/elevation-frontale-poulie-basse.gif
Exercices epaules,Thruster,"Depuis sa création, le CrossFit a fait découvrir de nombreux exercices et méthodes d’entraînement moins connus à un public plus large. Sans le CrossFit, les kettlebells n’auraient probablement pas connu un tel regain de popularité. Très peu de salles de sport auraient des rameurs Concept II ou des vélos d’assaut comme équipements standard. Et les seules personnes pratiquant des activités telles que la gymnastique, l’haltérophilie olympique et le powerlifting seraient des gymnastes, des haltérophiles et des powerlifters !",https://www.docteur-fitness.com/wp-content/uploads/2022/04/thruster.gif
Exercices epaules,Développé nuque barre guidée,"Cet exercice, réalisé à l’aide d’une Smith machine, entraîne une pression sur les muscles de la coiffe des rotateurs qui stabilisent les articulations de l’épaule. C’est pour cette raison qu’il est préférable de prendre une petite charge et de respecter le mouvement plutôt que de soulever trop de poids et de risquer de se blesser. Par ailleurs, le fait d’amener la charge derrière votre cou avec une charge lourde peut placer votre articulation de l’épaule dans une position susceptible de l’endommager ou de la disloquer.",https://www.docteur-fitness.com/wp-content/uploads/2022/08/developpe-nuque-barre-guidee.gif
Exercices biceps,Curl à la barre,"L’entraînement des biceps peut être relégué au second plan par rapport à des mouvements de force plus populaires comme le squat, le soulevé de terre et le développé couché.",https://www.docteur-fitness.com/wp-content/uploads/2021/09/curl-barre.gif
Exercices biceps,Curl concentré,"Le curl concentré est un mouvement de la vieille école qui peut produire de vrais résultats, mais seulement si vous êtes prêt à travailler avec une bonne technique.",https://www.docteur-fitness.com/wp-content/uploads/2021/09/curl-concentre.gif
Exercices biceps,Curl pupitre barre EZ,"Le curl assis au pupitre barre EZ (en anglais curl Larry Scott, du nom de son inventeur) offre un certain nombre d’avantages que vous ne trouverez peut-être pas dans un curl biceps classique. La conception de l’exercice permet de concentrer l’attention sur la partie négative de chaque répétition (lorsque vous redescendez la charge en position de départ). Cela favorise une forte connexion entre le cerveau et le muscle et maximise le temps sous tension ; deux aspects importants de la croissance musculaire.",https://www.docteur-fitness.com/wp-content/uploads/2022/01/curl-au-pupitre-barre-ez-larry-scott.gif
Exercices biceps,Curl allongé à la poulie,"Le curl allongé à la poulie est un exercice qui isole parfaitement les biceps, mais également les avant-bras. En position allongée, votre corps ne peut pas se pencher vers l’avant et utiliser l’élan pour soulever la charge. Cela permet de maximiser le travail du biceps brachial.",https://www.docteur-fitness.com/wp-content/uploads/2022/01/curl-allonge-a-la-poulie.gif
Exercices biceps,Curl poulie en position squat,"Cette variante du curl à la poulie (en anglais squatting cable curl) est un exercice qui permet de développer et renforcer les biceps, avec le corps en position de squat statique.",https://www.docteur-fitness.com/wp-content/uploads/2022/02/curl-poulie-en-position-squat.gif
Exercices biceps,Curl au pupitre à la poulie,"Depuis que Pumping Iron a popularisé le culturisme moderne en 1977, l’hypertrophie du biceps brachial a depuis été au premier plan de pratiquement tous les programmes de musculation depuis.",https://www.docteur-fitness.com/wp-content/uploads/2022/02/curl-pupitre-poulie.gif
Exercices biceps,Curl biceps assis à la machine,"Le curl biceps assis à la machine est un excellent exercice pour ceux qui souhaitent entraîner leurs biceps de manière intensive, et en toute sécurité. En fonction de la machine, vous avez la possibilité d’utiliser une prise en supination, une prise en pronation et, si la machine le permet, une prise neutre.",https://www.docteur-fitness.com/wp-content/uploads/2022/01/curl-pupitre-machine-prechargee.gif
Exercices biceps,Curl haltère debout sur banc incliné,Le curl debout avec haltère sur banc incliné (en anglais standing one-arm dumbbell curl over incline bench) est un mélange du curl sur un pupitre et du curl concentré. Le bras est en position fixe et le mouvement est lent et concentré.,https://www.docteur-fitness.com/wp-content/uploads/2022/02/curl-haltere-debout-banc-incline.gif
Exercices biceps,Curl Spider,Le curl spider (que certains traduisent en curl araignée) est un exercice d’isolation efficace pour développer les biceps. L’utilisation d’un banc incliné comme support permet de réaliser un mouvement strict et efficace.,https://www.docteur-fitness.com/wp-content/uploads/2022/01/spider-curl.gif
Exercices biceps,Curl haltère incliné avec rotation,Le curl incliné avec haltères est une variante du curl traditionnel avec haltères utilisée pour augmenter la taille des biceps.,https://www.docteur-fitness.com/wp-content/uploads/2021/10/curl-haltere-incline.gif
Exercices biceps,Curl biceps à la poulie basse,"Le curl à la poulie fait principalement travailler le biceps brachial, qui est le muscle à deux chefs situé à l’avant de votre bras et qui fusionne en un seul ventre musculaire près du coude.",https://www.docteur-fitness.com/wp-content/uploads/2021/10/curl-biceps-poulie-basse.gif
Exercices biceps,Traction supination,"Une traction en supination (chin up) est un exercice composé qui permet de faire travailler plusieurs groupes de muscles du haut du corps, en particulier ceux du dos (grands dorsaux, grands ronds et trapèzes).",https://www.docteur-fitness.com/wp-content/uploads/2021/08/chin-up-traction-supination.gif
Exercices biceps,Curl Zottman,"Le curl Zottman est un exercice unique avec haltères qui combine un curl biceps classique (main en supination), une rotation des poignets en haut du mouvement, puis un curl en prise inversée (main en pronation) pour revenir à la position de départ.",https://www.docteur-fitness.com/wp-content/uploads/2022/01/curl-zottman.gif
Exercices biceps,Curl en prise marteau avec élastique,"L’utilisation de bandes est un moyen ludique et efficace de varier vos entraînements et de stimuler votre corps. Les bandes élastiques offrent une résistance et une tension à toutes les étapes du mouvement, la partie négative de l’exercice (excentrique) ainsi que la phase positive (concentrique).",https://www.docteur-fitness.com/wp-content/uploads/2022/01/curl-avec-elastique.gif
